{"schema_version":1,"mode":"demo","generated_utc":"2026-10-19T12:00:00Z","as_of_utc":"2026-10-19T12:00:00Z","source":"demo-generator","events":[{"id":"EV-XAUUSD-1792410600","t_utc":"2026-10-19T11:55:00Z","type":"data","severity":"info","title":"XAUUSD buy-side liquidity sweep","detail":"M5, level 4041.68, bias BEARISH","symbol":"XAUUSD"},{"id":"EV-SCR-0","t_utc":"2026-10-19T11:53:00Z","type":"ci","severity":"ok","title":"CI: safety (ubuntu-latest) passed","detail":"branch develop","symbol":null},{"id":"EV-SCR-1","t_utc":"2026-10-19T11:45:00Z","type":"system","severity":"warn","title":"MT5 link not configured (demo)","detail":"history-only mode planned","symbol":null},{"id":"EV-T-0122-o","t_utc":"2026-10-19T11:34:00Z","type":"risk","severity":"info","title":"Paper SELL GBPJPY opened","detail":"T-0122: risk 0.25%, SL 193.823","symbol":"GBPJPY"},{"id":"EV-SCR-2","t_utc":"2026-10-19T11:20:00Z","type":"agent","severity":"info","title":"Strategy Evaluator recomputed candidate table","detail":"0 of 10 eligible","symbol":null},{"id":"EV-T-0121-o","t_utc":"2026-10-19T11:20:00Z","type":"risk","severity":"info","title":"Paper BUY XAUUSD opened","detail":"T-0121: risk 0.25%, SL 4031.6","symbol":"XAUUSD"},{"id":"EV-GBPUSD-1792407600","t_utc":"2026-10-19T11:05:00Z","type":"data","severity":"info","title":"GBPUSD sell-side liquidity sweep","detail":"M5, level 1.30074, bias BULLISH","symbol":"GBPUSD"},{"id":"EV-EURUSD-1792407600","t_utc":"2026-10-19T11:05:00Z","type":"data","severity":"info","title":"EURUSD sell-side liquidity sweep","detail":"M5, level 1.12695, bias BULLISH","symbol":"EURUSD"},{"id":"EV-SCR-3","t_utc":"2026-10-19T10:30:00Z","type":"ci","severity":"ok","title":"CI: baseline guard passed","detail":"V7.2 files unchanged","symbol":null},{"id":"EV-XAUUSD-1792404900","t_utc":"2026-10-19T10:20:00Z","type":"data","severity":"info","title":"XAUUSD sell-side liquidity sweep","detail":"M5, level 4042.71, bias BULLISH","symbol":"XAUUSD"},{"id":"EV-XAUUSD-1792404300","t_utc":"2026-10-19T10:10:00Z","type":"data","severity":"info","title":"XAUUSD buy-side liquidity sweep","detail":"M5, level 4053.82, bias BEARISH","symbol":"XAUUSD"},{"id":"EV-EURUSD-1792403100","t_utc":"2026-10-19T09:50:00Z","type":"data","severity":"info","title":"EURUSD sell-side liquidity sweep","detail":"M5, level 1.12724, bias BULLISH","symbol":"EURUSD"},{"id":"EV-EURUSD-1792402500","t_utc":"2026-10-19T09:40:00Z","type":"data","severity":"info","title":"EURUSD sell-side liquidity sweep","detail":"M5, level 1.12748, bias BULLISH","symbol":"EURUSD"},{"id":"EV-EURUSD-1792402500","t_utc":"2026-10-19T09:40:00Z","type":"data","severity":"info","title":"EURUSD sell-side liquidity sweep","detail":"M5, level 1.12742, bias BULLISH","symbol":"EURUSD"},{"id":"EV-EURUSD-1792401900","t_utc":"2026-10-19T09:30:00Z","type":"data","severity":"info","title":"EURUSD sell-side liquidity sweep","detail":"M5, level 1.12783, bias BULLISH","symbol":"EURUSD"},{"id":"EV-EURUSD-1792401300","t_utc":"2026-10-19T09:20:00Z","type":"data","severity":"info","title":"EURUSD buy-side liquidity sweep","detail":"M5, level 1.12844, bias BEARISH","symbol":"EURUSD"},{"id":"EV-XAUUSD-1792399800","t_utc":"2026-10-19T08:55:00Z","type":"data","severity":"info","title":"XAUUSD buy-side liquidity sweep","detail":"M5, level 4042.26, bias BEARISH","symbol":"XAUUSD"},{"id":"EV-XAUUSD-1792399200","t_utc":"2026-10-19T08:45:00Z","type":"data","severity":"info","title":"XAUUSD buy-side liquidity sweep","detail":"M5, level 4036.16, bias BEARISH","symbol":"XAUUSD"},{"id":"EV-GBPJPY-1792398300","t_utc":"2026-10-19T08:30:00Z","type":"data","severity":"info","title":"GBPJPY buy-side liquidity sweep","detail":"M5, level 193.027, bias BEARISH","symbol":"GBPJPY"},{"id":"EV-GBPJPY-1792398000","t_utc":"2026-10-19T08:25:00Z","type":"data","severity":"info","title":"GBPJPY buy-side liquidity sweep","detail":"M5, level 192.992, bias BEARISH","symbol":"GBPJPY"},{"id":"EV-XAUUSD-1792397400","t_utc":"2026-10-19T08:15:00Z","type":"data","severity":"info","title":"XAUUSD buy-side liquidity sweep","detail":"M5, level 4026.8, bias BEARISH","symbol":"XAUUSD"},{"id":"EV-XAUUSD-1792397400","t_utc":"2026-10-19T08:15:00Z","type":"data","severity":"info","title":"XAUUSD buy-side liquidity sweep","detail":"M5, level 4027.63, bias BEARISH","symbol":"XAUUSD"},{"id":"EV-XAUUSD-1792397100","t_utc":"2026-10-19T08:10:00Z","type":"data","severity":"info","title":"XAUUSD buy-side liquidity sweep","detail":"M5, level 4033.29, bias BEARISH","symbol":"XAUUSD"},{"id":"EV-GBPJPY-1792396800","t_utc":"2026-10-19T08:05:00Z","type":"data","severity":"info","title":"GBPJPY sell-side liquidity sweep","detail":"M5, level 192.707, bias BULLISH","symbol":"GBPJPY"},{"id":"EV-XAUUSD-1792396800","t_utc":"2026-10-19T08:05:00Z","type":"data","severity":"info","title":"XAUUSD buy-side liquidity sweep","detail":"M5, level 4034.51, bias BEARISH","symbol":"XAUUSD"},{"id":"EV-GBPJPY-1792396500","t_utc":"2026-10-19T08:00:00Z","type":"data","severity":"info","title":"GBPJPY sell-side liquidity sweep","detail":"M5, level 192.789, bias BULLISH","symbol":"GBPJPY"},{"id":"EV-EURUSD-1792396500","t_utc":"2026-10-19T08:00:00Z","type":"data","severity":"info","title":"EURUSD buy-side liquidity sweep","detail":"M5, level 1.12791, bias BEARISH","symbol":"EURUSD"},{"id":"EV-XAUUSD-1792395300","t_utc":"2026-10-19T07:40:00Z","type":"data","severity":"info","title":"XAUUSD sell-side liquidity sweep","detail":"M5, level 4015.04, bias BULLISH","symbol":"XAUUSD"},{"id":"EV-XAUUSD-1792394100","t_utc":"2026-10-19T07:20:00Z","type":"data","severity":"info","title":"XAUUSD sell-side liquidity sweep","detail":"M5, level 4022.24, bias BULLISH","symbol":"XAUUSD"},{"id":"EV-XAUUSD-1792394100","t_utc":"2026-10-19T07:20:00Z","type":"data","severity":"info","title":"XAUUSD sell-side liquidity sweep","detail":"M5, level 4022.14, bias BULLISH","symbol":"XAUUSD"},{"id":"EV-EURUSD-1792393500","t_utc":"2026-10-19T07:10:00Z","type":"data","severity":"info","title":"EURUSD buy-side liquidity sweep","detail":"M5, level 1.12789, bias BEARISH","symbol":"EURUSD"},{"id":"EV-EURUSD-1792393500","t_utc":"2026-10-19T07:10:00Z","type":"data","severity":"info","title":"EURUSD buy-side liquidity sweep","detail":"M5, level 1.12789, bias BEARISH","symbol":"EURUSD"},{"id":"EV-T-0120-c","t_utc":"2026-10-19T07:09:00Z","type":"risk","severity":"warn","title":"Paper GBPUSD closed STOP","detail":"T-0120: -1R","symbol":"GBPUSD"},{"id":"EV-T-0119-c","t_utc":"2026-10-19T07:09:00Z","type":"risk","severity":"ok","title":"Paper GBPUSD closed TARGET","detail":"T-0119: +0.6R","symbol":"GBPUSD"},{"id":"EV-T-0120-o","t_utc":"2026-10-19T07:04:00Z","type":"risk","severity":"info","title":"Paper SELL GBPUSD opened","detail":"T-0120: risk 0.25%, SL 1.29361","symbol":"GBPUSD"},{"id":"EV-T-0119-o","t_utc":"2026-10-19T07:03:00Z","type":"risk","severity":"info","title":"Paper BUY GBPUSD opened","detail":"T-0119: risk 0.25%, SL 1.29254","symbol":"GBPUSD"},{"id":"EV-GBPJPY-1792391700","t_utc":"2026-10-19T06:40:00Z","type":"data","severity":"info","title":"GBPJPY buy-side liquidity sweep","detail":"M5, level 192.942, bias BEARISH","symbol":"GBPJPY"},{"id":"EV-EURUSD-1792391700","t_utc":"2026-10-19T06:40:00Z","type":"data","severity":"info","title":"EURUSD buy-side liquidity sweep","detail":"M5, level 1.12787, bias BEARISH","symbol":"EURUSD"},{"id":"EV-GBPUSD-1792391100","t_utc":"2026-10-19T06:30:00Z","type":"data","severity":"info","title":"GBPUSD buy-side liquidity sweep","detail":"M5, level 1.29149, bias BEARISH","symbol":"GBPUSD"},{"id":"EV-EURUSD-1792390200","t_utc":"2026-10-19T06:15:00Z","type":"data","severity":"info","title":"EURUSD sell-side liquidity sweep","detail":"M5, level 1.1275, bias BULLISH","symbol":"EURUSD"},{"id":"EV-EURUSD-1792389300","t_utc":"2026-10-19T06:00:00Z","type":"data","severity":"info","title":"EURUSD sell-side liquidity sweep","detail":"M5, level 1.1273, bias BULLISH","symbol":"EURUSD"},{"id":"EV-EURUSD-1792389300","t_utc":"2026-10-19T06:00:00Z","type":"data","severity":"info","title":"EURUSD sell-side liquidity sweep","detail":"M5, level 1.12729, bias BULLISH","symbol":"EURUSD"},{"id":"EV-EURUSD-1792389300","t_utc":"2026-10-19T06:00:00Z","type":"data","severity":"info","title":"EURUSD buy-side liquidity sweep","detail":"M5, level 1.12733, bias BEARISH","symbol":"EURUSD"},{"id":"EV-XAUUSD-1792388700","t_utc":"2026-10-19T05:50:00Z","type":"data","severity":"info","title":"XAUUSD buy-side liquidity sweep","detail":"M5, level 4030.71, bias BEARISH","symbol":"XAUUSD"},{"id":"EV-EURUSD-1792387800","t_utc":"2026-10-19T05:35:00Z","type":"data","severity":"info","title":"EURUSD buy-side liquidity sweep","detail":"M5, level 1.12786, bias BEARISH","symbol":"EURUSD"},{"id":"EV-XAUUSD-1792386900","t_utc":"2026-10-19T05:20:00Z","type":"data","severity":"info","title":"XAUUSD sell-side liquidity sweep","detail":"M5, level 4024.46, bias BULLISH","symbol":"XAUUSD"},{"id":"EV-XAUUSD-1792386900","t_utc":"2026-10-19T05:20:00Z","type":"data","severity":"info","title":"XAUUSD sell-side liquidity sweep","detail":"M5, level 4024.1, bias BULLISH","symbol":"XAUUSD"},{"id":"EV-GBPUSD-1792386300","t_utc":"2026-10-19T05:10:00Z","type":"data","severity":"info","title":"GBPUSD sell-side liquidity sweep","detail":"M5, level 1.29072, bias BULLISH","symbol":"GBPUSD"},{"id":"EV-GBPUSD-1792385700","t_utc":"2026-10-19T05:00:00Z","type":"data","severity":"info","title":"GBPUSD buy-side liquidity sweep","detail":"M5, level 1.29062, bias BEARISH","symbol":"GBPUSD"},{"id":"EV-GBPJPY-1792385400","t_utc":"2026-10-19T04:55:00Z","type":"data","severity":"info","title":"GBPJPY buy-side liquidity sweep","detail":"M5, level 192.565, bias BEARISH","symbol":"GBPJPY"},{"id":"EV-XAUUSD-1792383900","t_utc":"2026-10-19T04:30:00Z","type":"data","severity":"info","title":"XAUUSD buy-side liquidity sweep","detail":"M5, level 4030.1, bias BEARISH","symbol":"XAUUSD"},{"id":"EV-EURUSD-1792382700","t_utc":"2026-10-19T04:10:00Z","type":"data","severity":"info","titl